{
  "schema_version": "qeva-sandbox/1",
  "id": "lab:example-collatz",
  "revision": 1,
  "title": "Collatz recurrence — personal experiment",
  "kernel_ref": "qeva:kernel:collatz@1",
  "parameters": {
    "start": "6",
    "steps": 80
  },
  "concept_refs": [
    "qeva:1:collatz-map@1"
  ],
  "claim": {
    "label": "experiment",
    "text": "This file records one bounded execution, not a universal claim.",
    "verification": "unreviewed"
  },
  "provenance": {
    "created_at": "2026-09-09T00:00:00.000Z",
    "creator_label": "Local learner (self-described)",
    "parent": null
  },
  "runs": [
    {
      "id": "example-run-1",
      "at": "2026-09-09T00:00:00.000Z",
      "result": {
        "engine": "qeva-kernels/1",
        "kernel_ref": "qeva:kernel:collatz@1",
        "arithmetic": "exact BigInt integer operations; exported values are decimal strings",
        "parameters": {
          "start": "6",
          "steps": 80
        },
        "status": "reached-one",
        "series": [
          [
            0,
            "6"
          ],
          [
            1,
            "3"
          ],
          [
            2,
            "10"
          ],
          [
            3,
            "5"
          ],
          [
            4,
            "16"
          ],
          [
            5,
            "8"
          ],
          [
            6,
            "4"
          ],
          [
            7,
            "2"
          ],
          [
            8,
            "1"
          ]
        ],
        "summary": {
          "iterations": 8,
          "peak": "16",
          "final": "1",
          "reached_one": true
        }
      },
      "note": "Reproduce from the declared parameters; preserve this baseline."
    }
  ]
}
