{
  "schema_version": "qeva-sandbox/1",
  "id": "lab:example-logistic",
  "revision": 1,
  "title": "Logistic recurrence — personal experiment",
  "kernel_ref": "qeva:kernel:logistic@1",
  "parameters": {
    "r": 3.9,
    "x0": 0.4,
    "delta": 0.0001,
    "steps": 70
  },
  "concept_refs": [
    "qeva:1:sensitivity@1"
  ],
  "claim": {
    "label": "experiment",
    "text": "Compare finite trajectories under a declared recurrence. No chaos theorem is claimed.",
    "verification": "unreviewed"
  },
  "provenance": {
    "created_at": "2026-09-09T00:00:00.000Z",
    "creator_label": "Local learner (self-described)",
    "parent": null
  },
  "runs": [
    {
      "id": "example-run-1",
      "at": "2026-09-09T00:00:00.000Z",
      "result": {
        "engine": "qeva-kernels/1",
        "kernel_ref": "qeva:kernel:logistic@1",
        "arithmetic": "binary64; explicit left-associated multiplication; finite trajectory, not proof",
        "parameters": {
          "r": 3.9,
          "x0": 0.4,
          "delta": 0.0001,
          "steps": 70
        },
        "status": "complete",
        "series": [
          [
            0,
            0.4,
            0.4001
          ],
          [
            1,
            0.9359999999999999,
            0.936077961
          ],
          [
            2,
            0.2336256000000002,
            0.2333604465273218
          ],
          [
            3,
            0.6982742481960964,
            0.697723059243174
          ],
          [
            4,
            0.8216805577588637,
            0.8225318081897292
          ],
          [
            5,
            0.5714343131637907,
            0.5692956075528687
          ],
          [
            6,
            0.9550988417209882,
            0.9562726632181273
          ],
          [
            7,
            0.16725167263043805,
            0.16307950151936573
          ],
          [
            8,
            0.5431863474677594,
            0.5322898530438875
          ],
          [
            9,
            0.9677262636303364,
            0.970933725022576
          ],
          [
            10,
            0.12180535501057962,
            0.11006356388180695
          ],
          [
            11,
            0.4171783609551725,
            0.38200334557102517
          ],
          [
            12,
            0.9482482468131205,
            0.9206994792199195
          ],
          [
            13,
            0.19138668599295894,
            0.2847465979179454
          ],
          [
            14,
            0.6035555074286068,
            0.7942972942791952
          ],
          [
            15,
            0.9331774018366947,
            0.6372175000617847
          ],
          [
            16,
            0.24319362029824174,
            0.901568294939497
          ],
          [
            17,
            0.7177968850434577,
            0.34609732754760214
          ],
          [
            18,
            0.7900016157749308,
            0.8826244729068387
          ],
          [
            19,
            0.6470063451069247,
            0.4040341996577792
          ],
          [
            20,
            0.8907176245433847,
            0.9390832041422403
          ],
          [
            21,
            0.37962497769758136,
            0.22310316537671643
          ],
          [
            22,
            0.9184884306221998,
            0.6759797576048632
          ],
          [
            23,
            0.29198299039793635,
            0.854221387162001
          ],
          [
            24,
            0.8062428024932384,
            0.4856561146204083
          ],
          [
            25,
            0.6092398490922407,
            0.9741975865136466
          ],
          [
            26,
            0.9284599559441874,
            0.09803293088406721
          ],
          [
            27,
            0.25904605799398944,
            0.344847653850753
          ],
          [
            28,
            0.7485706715438799,
            0.8811182229890986
          ],
          [
            29,
            0.7340292228680758,
            0.40852071041196375
          ],
          [
            30,
            0.7613982590906816,
            0.9423630043482261
          ],
          [
            31,
            0.7085167055630075,
            0.21182839229764416
          ],
          [
            32,
            0.8054310556544851,
            0.6511327856055342
          ],
          [
            33,
            0.6111762939429686,
            0.8859196363489353
          ],
          [
            34,
            0.9267953434939159,
            0.39415753369319145
          ],
          [
            35,
            0.2645983656104503,
            0.9313097520717591
          ],
          [
            36,
            0.7588856750542422,
            0.24949040129441089
          ],
          [
            37,
            0.7136150082816662,
            0.7302552697298224
          ],
          [
            38,
            0.7970376501236123,
            0.7682317919704222
          ],
          [
            39,
            0.6308976741952658,
            0.6944016525277109
          ],
          [
            40,
            0.9081766156720531,
            0.827611190228531
          ],
          [
            41,
            0.3252282166321853,
            0.5564165413444765
          ],
          [
            42,
            0.8558738125798911,
            0.9625869780646352
          ],
          [
            43,
            0.4810799351274248,
            0.1404518221276119
          ],
          [
            44,
            0.9736039214663483,
            0.47082792037571775
          ],
          [
            45,
            0.10022736972961815,
            0.9716810601045387
          ],
          [
            46,
            0.35170919193813227,
            0.10731621240076836
          ],
          [
            47,
            0.8892383613529973,
            0.3736178275312139
          ],
          [
            48,
            0.3841246423998107,
            0.9127074312800731
          ],
          [
            49,
            0.9226343158540102,
            0.3107230470481944
          ],
          [
            50,
            0.2783829167441896,
            0.835279516816992
          ],
          [
            51,
            0.78345488679583,
            0.5365918178515611
          ],
          [
            52,
            0.6616479758910965,
            0.9697780515786409
          ],
          [
            53,
            0.8730927343722149,
            0.1143034707944055
          ],
          [
            54,
            0.4321270650787892,
            0.39482893069915614
          ],
          [
            55,
            0.9570337323502063,
            0.9318622801102567
          ],
          [
            56,
            0.16036865322675606,
            0.24763038697008358
          ],
          [
            57,
            0.5251371383270708,
            0.726607355834608
          ],
          [
            58,
            0.9725356846792304,
            0.7747315144984247
          ],
          [
            59,
            0.10416910414845085,
            0.6806381202714673
          ],
          [
            60,
            0.36393981736850417,
            0.8477424910686845
          ],
          [
            61,
            0.9028017441389076,
            0.503393123630849
          ],
          [
            62,
            0.34222794418275077,
            0.9749550981769005
          ],
          [
            63,
            0.8779211157724753,
            0.0952288533915061
          ],
          [
            64,
            0.4179849579878204,
            0.336025243605656
          ],
          [
            65,
            0.9487667782465876,
            0.8701378891351207
          ],
          [
            66,
            0.1895726770944944,
            0.4406919778037287
          ],
          [
            67,
            0.5991760210555117,
            0.9612819781623497
          ],
          [
            68,
            0.9366400557056271,
            0.14515385282825508
          ],
          [
            69,
            0.23144730083820864,
            0.48392842616573656
          ],
          [
            70,
            0.6937298463143738,
            0.9739926476065102
          ]
        ],
        "summary": {
          "iterations": 70,
          "max_separation": 0.8714536903749206,
          "first_separation_above_0_1": 14,
          "final_separation": 0.2802628012921363
        }
      },
      "note": "Reproduce from the declared parameters; preserve this baseline."
    }
  ]
}
